{
  "allowed_uses": [
    "offline-review",
    "shadow"
  ],
  "assets": [
    {
      "asset_id": "collection_station",
      "broad_phase": {
        "kind": "aabb",
        "local_aabb_m": {
          "max_m": [
            0.325,
            0.26,
            0.85
          ],
          "min_m": [
            -0.325,
            -0.26,
            0.0
          ]
        }
      },
      "derivation": {
        "algorithm": "ptlc-parametric-visual-and-structural-collision",
        "algorithm_version": "v1",
        "generator_digest_mode": "utf8-lf-v1",
        "generator_ref": "related/unilabSZlab/pTLC仿真资产/scripts/generate_proxy_assets.py",
        "generator_sha256": "c7c64122640b59607ec1f3a4b935ca71702dc5978156387d09e45a22a9220749"
      },
      "entity_id": "ptlc.proxy:collection_station",
      "frame": {
        "frame_id": "asset:collection_station:local",
        "handedness": "right-handed",
        "origin_convention": "footprint-center-bottom-z0",
        "unit": "m",
        "up_axis": "+Z"
      },
      "narrow_phase": {
        "component_count": 6,
        "format": "stl",
        "local_aabb_m": {
          "max_m": [
            0.325,
            0.26,
            0.85
          ],
          "min_m": [
            -0.325,
            -0.26,
            0.0
          ]
        },
        "path": "related/unilabSZlab/pTLC仿真资产/proxies/collection_station/collision.stl",
        "representation": "multi-body-open",
        "sha256": "9b5139986ecb10d8d79ae50109f73f9631cd123859c0a8df00813e5adfcc7fc1",
        "source_unit": "mm",
        "watertight": true
      },
      "nominal_dimensions_m": [
        0.65,
        0.52,
        0.85
      ],
      "qc": {
        "bounds_abs_error_m_xyz": [
          0.0,
          0.0,
          0.0
        ],
        "bounds_match_nominal": true,
        "method": "pass when collision uses multiple closed bodies and their summed volume is below 70% of the envelope; overlap volumes are not boolean-unioned",
        "open_cavity_expected": true,
        "open_cavity_preserved": true,
        "source_components_disjoint": true,
        "summed_component_volume_ratio": 0.051874
      },
      "qualification": "collision-candidate",
      "reason_codes": [
        "collision-candidate-not-qualified",
        "photo-and-point-derived-not-metrology",
        "world-registration-not-qualified"
      ],
      "role": "static-environment",
      "source": {
        "artifact_digest_mode": "canonical-json-v1",
        "artifact_ref": "related/unilabSZlab/pTLC仿真资产/asset_manifest.json",
        "artifact_sha256": "684cc30b1497583f50e9a855fec3272279c8d76f7429578fc523c213473ea400",
        "kind": "parametric-spec",
        "parameter_digest": "ca4a57a2523ea9356aeaa990c162bf19f8ee2797a8830681b53dd9d5b064b02d",
        "parameter_pointer": "/proxy_assets/11"
      },
      "uncertainty_m_xyz": [
        0.14,
        0.12,
        0.16
      ],
      "visual": {
        "format": "glb",
        "local_aabb_m": {
          "max_m": [
            0.325,
            0.26,
            0.85
          ],
          "min_m": [
            -0.325,
            -0.26,
            0.0
          ]
        },
        "path": "related/unilabSZlab/pTLC仿真资产/proxies/collection_station/visual.glb",
        "sha256": "2a39320786b8f3dc4b33ea62a841103a647e9bfb8164f939348ae1f5f17ffcaa",
        "source_unit": "m"
      }
    },
    {
      "asset_id": "develop_tank_rack",
      "broad_phase": {
        "kind": "aabb",
        "local_aabb_m": {
          "max_m": [
            0.525,
            0.31,
            0.98
          ],
          "min_m": [
            -0.525,
            -0.31,
            0.0
          ]
        }
      },
      "derivation": {
        "algorithm": "source-geometry-collision-candidate-selection",
        "algorithm_version": "v3",
        "generator_digest_mode": "utf8-lf-v1",
        "generator_ref": "scripts/generate_collision_candidates.py",
        "generator_sha256": "7fa123e05ab2dc928044d191761a0e1a1c1f7fce447524de3f49ce3f9ddfcb67"
      },
      "entity_id": "ptlc.proxy:develop_tank_rack",
      "frame": {
        "frame_id": "asset:develop_tank_rack:local",
        "handedness": "right-handed",
        "origin_convention": "footprint-center-bottom-z0",
        "unit": "m",
        "up_axis": "+Z"
      },
      "narrow_phase": {
        "component_count": 40,
        "component_triangle_counts": [
          12,
          12,
          12,
          12,
          12,
          12,
          12,
          12,
          12,
          12,
          12,
          12,
          12,
          12,
          12,
          12,
          12,
          12,
          12,
          12,
          12,
          12,
          12,
          12,
          12,
          12,
          12,
          12,
          12,
          12,
          12,
          12,
          12,
          12,
          12,
          12,
          12,
          12,
          12,
          12
        ],
        "format": "stl",
        "local_aabb_m": {
          "max_m": [
            0.524999976158,
            0.310000002384,
            0.980000019073
          ],
          "min_m": [
            -0.524999976158,
            -0.310000002384,
            0.0
          ]
        },
        "path": "artifacts/collision-candidates/v3/develop-tank-rack/l2/compound-convex.runtime.stl",
        "representation": "compound-convex",
        "sha256": "d90db8b6539a349758b59e6daf6c96760efdfedcdc16ee1dbcd1e3978eb3e393",
        "source_unit": "m",
        "watertight": true
      },
      "nominal_dimensions_m": [
        1.05,
        0.62,
        0.98
      ],
      "qc": {
        "bounds_abs_error_m_xyz": [
          0.0,
          0.0,
          0.0
        ],
        "bounds_match_nominal": true,
        "method": "added-solid-volume-fraction-of-source-aabb",
        "open_cavity_expected": true,
        "open_cavity_preserved": true,
        "source_components_disjoint": true,
        "summed_component_volume_ratio": 0.224410684177
      },
      "qualification": "collision-candidate",
      "reason_codes": [
        "collision-candidate-not-qualified",
        "photo-and-point-derived-not-metrology",
        "world-registration-not-qualified"
      ],
      "role": "static-environment",
      "source": {
        "artifact_digest_mode": "canonical-json-v1",
        "artifact_ref": "related/unilabSZlab/pTLC仿真资产/asset_manifest.json",
        "artifact_sha256": "684cc30b1497583f50e9a855fec3272279c8d76f7429578fc523c213473ea400",
        "kind": "parametric-spec",
        "parameter_digest": "62d26e03730bdbd433ff627509016d698423723328c43076c3faa13173b20eee",
        "parameter_pointer": "/proxy_assets/3"
      },
      "uncertainty_m_xyz": [
        0.25,
        0.18,
        0.3
      ],
      "visual": {
        "format": "glb",
        "local_aabb_m": {
          "max_m": [
            0.525,
            0.31,
            0.98
          ],
          "min_m": [
            -0.525,
            -0.31,
            0.0
          ]
        },
        "path": "related/unilabSZlab/pTLC仿真资产/proxies/develop_tank_rack/visual.glb",
        "sha256": "773ef4fcdb3126fe51e785404386da0acf4b509024d7f567b317b9c7227b9c01",
        "source_unit": "m"
      }
    },
    {
      "asset_id": "feed_lift",
      "broad_phase": {
        "kind": "aabb",
        "local_aabb_m": {
          "max_m": [
            0.24,
            0.225,
            1.05
          ],
          "min_m": [
            -0.24,
            -0.225,
            0.0
          ]
        }
      },
      "derivation": {
        "algorithm": "ptlc-parametric-visual-and-structural-collision",
        "algorithm_version": "v1",
        "generator_digest_mode": "utf8-lf-v1",
        "generator_ref": "related/unilabSZlab/pTLC仿真资产/scripts/generate_proxy_assets.py",
        "generator_sha256": "c7c64122640b59607ec1f3a4b935ca71702dc5978156387d09e45a22a9220749"
      },
      "entity_id": "ptlc.proxy:feed_lift",
      "frame": {
        "frame_id": "asset:feed_lift:local",
        "handedness": "right-handed",
        "origin_convention": "footprint-center-bottom-z0",
        "unit": "m",
        "up_axis": "+Z"
      },
      "narrow_phase": {
        "component_count": 10,
        "format": "stl",
        "local_aabb_m": {
          "max_m": [
            0.24,
            0.225,
            1.05
          ],
          "min_m": [
            -0.24,
            -0.225,
            0.0
          ]
        },
        "path": "related/unilabSZlab/pTLC仿真资产/proxies/feed_lift/collision.stl",
        "representation": "multi-body-open",
        "sha256": "bd6209d481a8469a4350cf8cc71e3765ecb9ae9ee21392ae6c4d8fc33d4eb4b0",
        "source_unit": "mm",
        "watertight": true
      },
      "nominal_dimensions_m": [
        0.48,
        0.45,
        1.05
      ],
      "qc": {
        "bounds_abs_error_m_xyz": [
          0.0,
          0.0,
          0.0
        ],
        "bounds_match_nominal": true,
        "method": "pass when collision uses multiple closed bodies and their summed volume is below 70% of the envelope; overlap volumes are not boolean-unioned",
        "open_cavity_expected": true,
        "open_cavity_preserved": true,
        "source_components_disjoint": true,
        "summed_component_volume_ratio": 0.056892
      },
      "qualification": "collision-candidate",
      "reason_codes": [
        "collision-candidate-not-qualified",
        "photo-and-point-derived-not-metrology",
        "world-registration-not-qualified"
      ],
      "role": "static-environment",
      "source": {
        "artifact_digest_mode": "canonical-json-v1",
        "artifact_ref": "related/unilabSZlab/pTLC仿真资产/asset_manifest.json",
        "artifact_sha256": "684cc30b1497583f50e9a855fec3272279c8d76f7429578fc523c213473ea400",
        "kind": "parametric-spec",
        "parameter_digest": "25fd69ca76a7a9155cb2bc61eae4a2d5aa69cc565c085bfcbf6c7c80d995a068",